Nome,Código,Força,Velocidade,Inteligência,Poderes,Curiosidade1,Curiosidade2,Curiosidade3,SuperTrunfo
Thánatos,1A,91,85,84,91,É a personificação da morte na mitologia grega,Representado comumente por uma nevoa,Filho dos deuses primordiais Érebo e Nix,true
Caos,2A,89,88,81,92,O primeiro deus primordial na mitologia grega,É a personificação do vazio original ou o ar que preenchia o espaço entre a Terra e o Éter (céu superior),Criou os filhos Nix e Érebo a partir dele mesmo,false
Érebo,3A,88,79,75,89,É a personificação das trevas e da escuridão no universo mitologia grega,Dominava as partes do universo conhecidas como vácuo,Pode ver a morte de uma pessoa com apenas um simples contato fisico,false
Nix,4A,86,90,85,96,É a personificação da noite profunda na mitologia grega,Temida e respeitada por todos os outros deuses, por se acreditar tinha total controle sobre vida e morte, tanto de homens como de deuses,Apesar de estar ligada a escuridao seus poderes não estavam so ligados a isso, tinha dominio sobre a luz, trazer vida, iluminar as trevas e trazer fertilidade,false
Gaia,5A,82,78,90,90,Simboliza a Terra na mitologia grega, possui a força da natureza,Criou Ponto, Urano e as montanhas,Se casou com Urano e foi a mãe dos doze Titãs,false
Cronos,6A,97,76,90,98,O mais jovem dos Titãs, fillho de Gaia com Urano. Por seu pai aprisionar ele, seus irmãos e irmãs, cortou ele em varios em varios pedaços com uma foice dada pela propria Gaia,Era o deus do tempo e se tornou o primeiro Rei dos deuses apos destituir seu pai,Por causa de uma profecia que dizia que ia ser destronado por um de seus filhos, Cronos acaba engolindo todos os filhos e filhas quando nascem.,false
Zeus,7A,96,85,86,95,Filho de Reia com Cronos, o unico filho que não foi comido por seu pai, porque sua mãe entregou uma pedra embrulhada como um bebe para Cronos, quando cresceu derrotou seu pai e libertou seu irmãos e irmãs, se tornou o Rei dos deuses e comanda os deuses ate o que seria os dias de hoje,Ao matar Cronos que era o deus do tempo, teria conquistado a imortalidade para os deuses,É o detentor do raio e era o deus dos céus, do raio e do trovão,false
Poseidon,8A,95,90,89,94,Deus do mar, dos terremotos e das tempestades e um dos 3 grandes, junto de seus irmãos Zeus e Hades,Os gregos acreditavam que Poseidon era um deus domador de cavalos e o responsavel por sua reprodução e acreditavam que o ato de cavalgar e a utilização de carruagem foram introduzidos entre os humanos por ele,Com sua irmã Demeter teve dois filhos gemeos, Arion, um cavalo divino imortal e Despina, a deusa do inverno e geadas,false
Hades,1B,94,88,92,93,É o deus do submundo, sendo o senhor desse dominio e responsavel por deixar que as almas dos mortos não retornassem ao mundo dos vivos,Se apaixonou por Perséfone, que é filha de Deméter, e acabou raptando ela para ter como sua rainha,Tinha um cão de guarda de 3 cabeças para ajudar a proteger o saida do submundo,false
Hera,2B,90,80,88,94,Deusa das mulheres, dos casamentos, da familia e dos nascimentos,Casada com Zeus, então era vista como rainha dos deuses,Chamada de Juno pelos romanos,false
Atena,3B,85,90,97,88,A deusa da sabedoria, muito associada a guerra pelo lado estrategico,O animal que representa ela é a coruja,Por causa de uma disputa para ser o padroeiros de uma cidade estado para homenagear e levar o nome de um deus, que é cidade de Atenas hoje, Atenas e Poseidon se odeiam,false
Ares,4B,92,87,88,91,Deus da guerra, relacionado com a brutalidade e o derramamento de sangue, representava o aspecto mais violento da guerra,Nao era muito adorado pelo outros deuses,Principal deus adorado em Esparta, por causa da personalidade e do apreço à guerra,false
Deméter,5B,74,79,87,76,Deusa da agricultura e a responsavel pelo crescimento dos grãos,Seu nome no grego antigo significa Deusa Mãe,Divide a posição de patrona da agricultura com sua filha Perséfone,false
Dionísio,6B,92,81,85,95,Deus do vinho, das festas, da alegria e do teatro, filho de Zeus e Sêmele,Por causa de um ataque de Hera, a mãe de Dionísio morreu quando estava gravida de 6 meses ainda, Zeus o conseguiu salvar, curou ele e o gerou o resto do tempo em sua propria coxa. Por isso é dito que Dionisio nasceu da coxa de Zeus,Era um semideus, por causa da sua mãe e foi o unico caso de um semideus que passou a ser um deus e ainda foi aceito no Monte Olimpo, como um dos 12 grandes.,false
Hermes,7B,82,100,93,81,Deus da velocidade e do comércio, protegia os viajantes, magicos e adivinhos,Patrono dos ladrões, dos malandros e trapaceiros,Quando nasceu, fugiu do berço e roubou 50 novilhas de seu irmão Apolo,false
Artemis,8B,83,98,83,85,Deusa da caça, da Lua, das castidade, do parto e dos animais selvagens,Patrona dos caçadores e cuidava das mulheres gravidas, cuidar de doenças femininas e proteger as crianças e o jovens,Escolheu se manter virgem e por isso nao teve filhos, nem se casou,false
Apolo,1C,91,89,94,91,Irmão gemeo de Artemis, é deus do Sol, patrono da luz, da musica, de medicina, das artes, da profecia e outros,Foi atribuido o titulo de deus da beleza por causa de beleza nata, mas não detinha esse poder,Criou a flor de louros por causa de um amante que morreu tragicamente,false
Hefesto,2C,99,60,71,87,Deus dos ferreiros, dos artesãos, dos escultores, da metalurgia, das armas, do fogo e na mitoloia romana tambem era deus do vulcão,Por causa de uma punição de Zeus, acabou ficando deformado e coxo, quando foi lançado do alto do Olimpo,Se casou com Afrodite, mas ela o traia com Ares e montou uma armadilha para punir os dois,false
Afrodite,3C,81,76,88,86,Deusa do amor, da beleza, do desejo e da fertilidade, considerada a deus mais bela entre as divindades gregas,Na versão de Hesíoso, quando cronos castrou o pai e jogou o orgão no oceano, surgiu uma espuma e Afrodite nasceu dela,Na versão de Homero, Afrodite nasceu de Zeus com a titânide Dione na ilha de Creta,false
Hestia,4C,81,78,88,85,Deusa do lar, da lareira, da vida domestica e da hospitalidade,Seu dever é manter o fogo sagrado do Monte Olimpo seguro,Era uma deusa bondosa que ajudava a manter a paz entre as pessoas da familia e ensinava as pessoas a construir suas casas,false
Reia,5C,81,79,89,89,É a mãe dos deuses, casado com Cronos e teve o plano de esconder Zeus de seu marido e o escondeu numa caverna no Monte Ida em Creta, para crescer e enfrentar Cronos,Depois de esconder Zeus, ela fugiu de Cronos e ficou escondida em varios lugares na Asia,Seus simbolos sao a Biga e o Leao,false
Mmemosine,6C,83,78,89,94,Faz parte dos 12 titãs, é e a deusa da memoria e da lembrança,Mãe das 9 musas com Zeus,Era uma das divindades cultuadas no culto de Asclepio,false
Temis,7C,86,93,94,89,Deusa da consciencia coletiva e da ordem social, da lei espiritual divina, paz, justiça divina e mais algumas coisas,Ja foi esposa e conselheira de Zeus,É mãe das Horas, que são Irene(paz), Dice(justiça), Eunomia(disciplina). Suas filhas são uma extensão dos seus atributos,false
Tetis,8C,77,76,88,79,É uma titanie e deusa antiga mãe das Oceânides,Ja foi uma das esposas de Zeus,Durante a guerra entre titãs e os deuses olímpicos, cuidou de Hera e foi recompensada por isso no final,false
Thor,1D,99,80,67,97,Considerado o deus nordico mais forte, deus do trovão e filho de Odin,Uma vez para recuperar seu martelo roubado (mjolnir), se disfaçou de Freya e quase se casou com o rei dos gigantes de gelo,Em uma disputa com um feiticeiro, bebeu em um gole uma quantidade tao grande do mar que ele abaixou em um dedo,false
Odin,2D,91,78,99,95,Deus nordico da sabedoria e pai dos deuses,Para alcançar a sabedoria maxima, sacrificou um olho e ficou nove dias enforcado e sendo flagelado pelo vento, na Yggdrasil,Tem dois corvos que contam tudo que eles vêem e ouvem, em todos os 9 mundos. Por isso Odin tem informação do mundo todo,false
Loki,3D,75,84,95,90,Meio gigante e meio deus, pai da mentiras e das trapaças, na mitologia Loki é irmao jurado de Odin,Por causa da sua interferencia, os ferreiros que faziam o martelo de Thor cometeram um erro e fizeram o cabo curto,Tem um filho cavalo de oito pernas, Sleipnir, dito como o cavalo mais rapido dos 9 reinos que podia andar sobre a terra, a água e o ar,false
Balder,4D,92,84,87,94,Deus nordico da justiça e sabedoria, filho de Odin,Era tão querido por todos, que sua mãe Frigga, conseguiu fazer quase todos os elementos do mundo jurarem nunca ferir Balder,Por causa de Loki, Balder foi morto por um minusculo musgo que foi o unico elemento que não jurou nada pois Frigga o achou inofensivo,false
Frigga,5D,70,76,92,85,Deusa nordica da fertilidade, do amor e da união. considerada deusa-mãe,Tinha o dom de prever o futuro, mas não eram visões exatas então não revelava elas para outros,Esposa de Odin e filha da gigante Fjorgynn,false
Sif,6D,87,93,94,89,Deusa das batalhas e habilidade em combate, mas existem aqueles que dizem que existe informação insuficiente para determinar isso,Esposa de Thor, era conhecida por seu belo cabelo longo e loiro,Loki um dia raspou o seu cabelo e por temer Thor, Loki acabou arrumando um cabelo magico para Sif,false
Frey,7D,91,84,81,85,Deus nordico do cla dos Vanes, representado como belo e deus da prosperidade, boas colheitas e da agricultura,Possui uma espada magica que é capaz de lutar sozinha,Irmão de Freya,false
Jormungandr,8D,98,69,66,81,Tambem conhecida como Serpente de Midgard, filho de Loki,Tão grande que consegue dar a volta o mundo pelo tamanho,Sua força rivalizava com a de Thor, no Ragnarok, na luta entre os dois, Thor mata a serpente mas morre pelo veneno que ela solta depois quando o corpo atinge o chão,false
